Status,N,Name,City,Street,Lat,Lon,Type,Display
200,1/1,Red Lion,Wien,Löwengasse,48.211562,16.3895739,amenity/pub,"Red Lion, 6, Löwengasse, Weißgerber, Landstraße, Wien, 1030, Österreich"
200,1/1,O'Connors,Wien,Rennweg,48.1888924,16.4000846,amenity/pub,"O’Connor’s Old Oak Irish Pub, 95/2/1, Rennweg, St. Marx, Erdberg, Landstraße, Wien, 1030, Österreich"
200,1/1,Hawidere,Wien,Ullmannstraße,48.1877536,16.3339482,amenity/pub,"Hawidere, 31, Ullmannstraße, Reindorf, Sechshaus, Rudolfsheim-Fünfhaus, Wien, 1150, Österreich"
200,1/1,Pivothek,Wien,Landstraßer Gürtel,48.1885167,16.3862665,amenity/pub,"Pivothek, 19, Landstraßer Gürtel, Fasanviertel, Landstraße, Wien, 1030, Österreich"
200,1/1,Ü-Lokal,Wien,Obere Augartenstraße,48.2212083,16.3770473,amenity/restaurant,"Ü Lokal, 46, Obere Augartenstraße, Rembrandtviertel, Leopoldstadt, Wien, 1020, Österreich"
